CVE ID,Published,Description,Base Score
CVE-2016-3634,2016-10-03T16:09:11.587,The tagCompare function in tif_dirinfo.c in the thumbnail tool in LibTIFF 4.0.6 and earlier allows remote attackers to cause a denial of service (out-of-bounds read) via vectors related to field_tag matching.,V3.0: 7.5
CVE-2016-3658,2016-10-03T16:09:12.697,The TIFFWriteDirectoryTagLongLong8Array function in tif_dirwrite.c in the tiffset tool in LibTIFF 4.0.6 and earlier allows remote attackers to cause a denial of service (out-of-bounds read) via vectors involving the ma variable.,V3.0: 7.5
CVE-2016-8331,2016-10-28T20:59:00.190,An exploitable remote code execution vulnerability exists in the handling of TIFF images in LibTIFF version 4.0.6. A crafted TIFF document can lead to a type confusion vulnerability resulting in remote code execution. This vulnerability can be triggered via a TIFF file delivered to the application using LibTIFF's tag extension functionality.,V3.0: 8.1
CVE-2016-9533,2016-11-22T19:59:00.213,"tif_pixarlog.c in libtiff 4.0.6 has out-of-bounds write vulnerabilities in heap allocated buffers. Reported as MSVR 35094, aka ""PixarLog horizontalDifference heap-buffer-overflow.""",V3.0: 9.8
CVE-2016-9534,2016-11-22T19:59:02.010,"tif_write.c in libtiff 4.0.6 has an issue in the error code path of TIFFFlushData1() that didn't reset the tif_rawcc and tif_rawcp members. Reported as MSVR 35095, aka ""TIFFFlushData1 heap-buffer-overflow.""",V3.0: 9.8
CVE-2016-9535,2016-11-22T19:59:03.387,"tif_predict.h and tif_predict.c in libtiff 4.0.6 have assertions that can lead to assertion failures in debug mode, or buffer overflows in release mode, when dealing with unusual tile size like YCbCr with subsampling. Reported as MSVR 35105, aka ""Predictor heap-buffer-overflow.""",V3.0: 9.8
CVE-2016-9536,2016-11-22T19:59:04.480,"tools/tiff2pdf.c in libtiff 4.0.6 has out-of-bounds write vulnerabilities in heap allocated buffers in t2p_process_jpeg_strip(). Reported as MSVR 35098, aka ""t2p_process_jpeg_strip heap-buffer-overflow.""",V3.0: 9.8
CVE-2016-9537,2016-11-22T19:59:05.527,"tools/tiffcrop.c in libtiff 4.0.6 has out-of-bounds write vulnerabilities in buffers. Reported as MSVR 35093, MSVR 35096, and MSVR 35097.",V3.0: 9.8
CVE-2016-9538,2016-11-22T19:59:06.510,tools/tiffcrop.c in libtiff 4.0.6 reads an undefined buffer in readContigStripsIntoBuffer() because of a uint16 integer overflow. Reported as MSVR 35100.,V3.0: 9.8
CVE-2016-9539,2016-11-22T19:59:07.807,tools/tiffcrop.c in libtiff 4.0.6 has an out-of-bounds read in readContigTilesIntoBuffer(). Reported as MSVR 35092.,V3.0: 9.8
CVE-2016-9540,2016-11-22T19:59:08.840,"tools/tiffcp.c in libtiff 4.0.6 has an out-of-bounds write on tiled images with odd tile width versus image width. Reported as MSVR 35103, aka ""cpStripToTile heap-buffer-overflow.""",V3.0: 9.8
CVE-2015-8870,2016-12-06T18:59:00.287,"Integer overflow in tools/bmp2tiff.c in LibTIFF before 4.0.4 allows remote attackers to cause a denial of service (heap-based buffer over-read), or possibly obtain sensitive information from process memory, via crafted width and length values in RLE4 or RLE8 data in a BMP file.",V3.0: 7.4
CVE-2016-5652,2017-01-06T21:59:01.680,An exploitable heap-based buffer overflow exists in the handling of TIFF images in LibTIFF's TIFF2PDF tool. A crafted TIFF document can lead to a heap-based buffer overflow resulting in remote code execution. Vulnerability can be triggered via a saved TIFF file delivered by other means.,V3.0: 7.0
CVE-2017-5225,2017-01-12T11:59:00.133,LibTIFF version 4.0.7 is vulnerable to a heap buffer overflow in the tools/tiffcp resulting in DoS or code execution via a crafted BitsPerSample value.,V3.0: 9.8
CVE-2016-9273,2017-01-18T17:59:01.183,"tiffsplit in libtiff 4.0.6 allows remote attackers to cause a denial of service (out-of-bounds read) via a crafted file, related to changing td_nstrips in TIFF_STRIPCHOP mode.",V3.0: 5.5
CVE-2016-9297,2017-01-18T17:59:01.293,The TIFFFetchNormalTag function in LibTiff 4.0.6 allows remote attackers to cause a denial of service (out-of-bounds read) via crafted TIFF_SETGET_C16ASCII or TIFF_SETGET_C32_ASCII tag values.,V3.0: 7.5
CVE-2016-5316,2017-01-20T15:59:00.300,Out-of-bounds read in the PixarLogCleanup function in tif_pixarlog.c in libtiff 4.0.6 and earlier allows remote attackers to crash the application by sending a crafted TIFF image to the rgb2ycbcr tool.,V3.0: 6.5
CVE-2016-5317,2017-01-20T15:59:00.347,"Buffer overflow in the PixarLogDecode function in libtiff.so in the PixarLogDecode function in libtiff 4.0.6 and earlier, as used in GNOME nautilus, allows attackers to cause a denial of service attack (crash) via a crafted TIFF file.",V3.0: 6.5
CVE-2016-5318,2017-01-20T15:59:00.397,Stack-based buffer overflow in the _TIFFVGetField function in libtiff 4.0.6 and earlier allows remote attackers to crash the application via a crafted tiff.,V3.0: 6.5
CVE-2016-5319,2017-01-20T15:59:00.443,Heap-based buffer overflow in tif_packbits.c in libtiff 4.0.6 and earlier allows remote attackers to crash the application via a crafted bmp file.,V3.0: 6.5
CVE-2016-5321,2017-01-20T15:59:00.490,The DumpModeDecode function in libtiff 4.0.6 and earlier allows attackers to cause a denial of service (invalid read and crash) via a crafted tiff image.,V3.0: 6.5
CVE-2016-5323,2017-01-20T15:59:00.520,The _TIFFFax3fillruns function in libtiff before 4.0.6 allows remote attackers to cause a denial of service (divide-by-zero error and application crash) via a crafted Tiff image.,V3.0: 7.5
CVE-2017-5563,2017-01-23T07:59:00.690,LibTIFF version 4.0.7 is vulnerable to a heap-based buffer over-read in tif_lzw.c resulting in DoS or code execution via a crafted bmp image to tools/bmp2tiff.,V3.0: 8.8
CVE-2016-6223,2017-01-23T21:59:01.970,The TIFFReadRawStrip1 and TIFFReadRawTile1 functions in tif_read.c in libtiff before 4.0.7 allows remote attackers to cause a denial of service (crash) or possibly obtain sensitive information via a negative index in a file-content buffer.,V3.0: 9.1
CVE-2016-9448,2017-01-27T17:59:00.290,The TIFFFetchNormalTag function in LibTiff 4.0.6 allows remote attackers to cause a denial of service (NULL pointer dereference and crash) by setting the tags TIFF_SETGET_C16ASCII or TIFF_SETGET_C32_ASCII to values that access 0-byte arrays.  NOTE: this vulnerability exists because of an incomplete fix for CVE-2016-9297.,V3.0: 7.5
CVE-2016-9453,2017-01-27T17:59:00.337,The t2p_readwrite_pdf_image_tile function in LibTIFF allows remote attackers to cause a denial of service (out-of-bounds write and crash) or possibly execute arbitrary code via a JPEG file with a TIFFTAG_JPEGTABLES of length one.,V3.1: 7.8
CVE-2016-5102,2017-02-06T17:59:00.140,Buffer overflow in the readgifimage function in gif2tiff.c in the gif2tiff tool in LibTIFF 4.0.6 allows remote attackers to cause a denial of service (segmentation fault) via a crafted gif file.,V3.0: 5.5
CVE-2016-9532,2017-02-06T17:59:00.407,Integer overflow in the writeBufferToSeparateStrips function in tiffcrop.c in LibTIFF before 4.0.7 allows remote attackers to cause a denial of service (out-of-bounds read) via a crafted tif file.,V3.0: 5.5
CVE-2016-10092,2017-03-01T15:59:00.150,"Heap-based buffer overflow in the readContigStripsIntoBuffer function in tif_unix.c in LibTIFF 4.0.7, 3.9.3, 3.9.4, 3.9.5, 3.9.6, 3.9.7, 4.0.0alpha4, 4.0.0alpha5, 4.0.0alpha6, 4.0.0beta7, 4.0.0, 4.0.1, 4.0.2, 4.0.3, 4.0.4, 4.0.4beta, 4.0.5 and 4.0.6 allows remote attackers to have unspecified impact via a crafted image.",V3.0: 7.8
CVE-2016-10093,2017-03-01T15:59:00.197,"Integer overflow in tools/tiffcp.c in LibTIFF 4.0.7, 3.9.3, 3.9.4, 3.9.5, 3.9.6, 3.9.7, 4.0.0alpha4, 4.0.0alpha5, 4.0.0alpha6, 4.0.0beta7, 4.0.0, 4.0.1, 4.0.2, 4.0.3, 4.0.4, 4.0.4beta, 4.0.5 and 4.0.6 allows remote attackers to have unspecified impact via a crafted image, which triggers a heap-based buffer overflow.",V3.0: 7.8
CVE-2016-10094,2017-03-01T15:59:00.243,Off-by-one error in the t2p_readwrite_pdf_image_tile function in tools/tiff2pdf.c in LibTIFF 4.0.7 allows remote attackers to have unspecified impact via a crafted image.,V3.0: 7.8
CVE-2016-10095,2017-03-01T15:59:00.290,"Stack-based buffer overflow in the _TIFFVGetField function in tif_dir.c in LibTIFF 4.0.0alpha4, 4.0.0alpha5, 4.0.0alpha6, 4.0.0beta7, 4.0.0, 4.0.1, 4.0.2, 4.0.3, 4.0.4, 4.0.4beta, 4.0.5, 4.0.6, 4.0.7 and 4.0.8 allows remote attackers to cause a denial of service (crash) via a crafted TIFF file.",V3.0: 5.5
CVE-2016-5315,2017-03-07T15:59:00.283,The setByteArray function in tif_dir.c in libtiff 4.0.6 and earlier allows remote attackers to cause a denial of service (out-of-bounds read) via a crafted tiff image.,V3.0: 5.5
CVE-2017-5849,2017-03-15T19:59:00.440,"tiffttopnm in netpbm 10.47.63 does not properly use the libtiff TIFFRGBAImageGet function, which allows remote attackers to cause a denial of service (out-of-bounds read and write) via a crafted tiff image file, related to transposing width and height values.",V3.0: 5.5
CVE-2015-7313,2017-03-17T14:59:00.843,LibTIFF allows remote attackers to cause a denial of service (memory consumption and crash) via a crafted tiff file.,V3.0: 5.5
CVE-2016-10266,2017-03-24T19:59:00.160,"LibTIFF 4.0.7 allows remote attackers to cause a denial of service (divide-by-zero error and application crash) via a crafted TIFF image, related to libtiff/tif_read.c:351:22.",V3.0: 5.5
CVE-2016-10267,2017-03-24T19:59:00.190,"LibTIFF 4.0.7 allows remote attackers to cause a denial of service (divide-by-zero error and application crash) via a crafted TIFF image, related to libtiff/tif_ojpeg.c:816:8.",V3.0: 5.5
CVE-2016-10268,2017-03-24T19:59:00.220,"tools/tiffcp.c in LibTIFF 4.0.7 allows remote attackers to cause a denial of service (integer underflow and heap-based buffer under-read) or possibly have unspecified other impact via a crafted TIFF image, related to ""READ of size 78490"" and libtiff/tif_unix.c:115:23.",V3.0: 7.8
CVE-2016-10269,2017-03-24T19:59:00.253,"LibTIFF 4.0.0alpha4, 4.0.0alpha5, 4.0.0alpha6, 4.0.0beta7, 4.0.0, 4.0.1, 4.0.2, 4.0.3, 4.0.4, 4.0.4beta, 4.0.5, 4.0.6 and 4.0.7 allows remote attackers to cause a denial of service (heap-based buffer over-read) or possibly have unspecified other impact via a crafted TIFF image, related to ""READ of size 512"" and libtiff/tif_unix.c:340:2.",V3.0: 7.8
CVE-2016-10270,2017-03-24T19:59:00.283,"LibTIFF 4.0.7 allows remote attackers to cause a denial of service (heap-based buffer over-read) or possibly have unspecified other impact via a crafted TIFF image, related to ""READ of size 8"" and libtiff/tif_read.c:523:22.",V3.0: 7.8
CVE-2016-10271,2017-03-24T19:59:00.317,"tools/tiffcrop.c in LibTIFF 4.0.7 allows remote attackers to cause a denial of service (heap-based buffer over-read and buffer overflow) or possibly have unspecified other impact via a crafted TIFF image, related to ""READ of size 1"" and libtiff/tif_fax3.c:413:13.",V3.0: 7.8
CVE-2016-10272,2017-03-24T19:59:00.347,"LibTIFF 4.0.7 allows remote attackers to cause a denial of service (heap-based buffer overflow) or possibly have unspecified other impact via a crafted TIFF image, related to ""WRITE of size 2048"" and libtiff/tif_next.c:64:9.",V3.0: 7.8
CVE-2017-7592,2017-04-09T14:59:00.153,"The putagreytile function in tif_getimage.c in LibTIFF 4.0.7 has a left-shift undefined behavior issue, which might allow remote attackers to cause a denial of service (application crash) or possibly have unspecified other impact via a crafted image.",V3.0: 7.8
CVE-2017-7593,2017-04-09T14:59:00.200,"tif_read.c in LibTIFF 4.0.7 does not ensure that tif_rawdata is properly initialized, which might allow remote attackers to obtain sensitive information from process memory via a crafted image.",V3.0: 5.5
CVE-2017-7594,2017-04-09T14:59:00.230,The OJPEGReadHeaderInfoSecTablesDcTable function in tif_ojpeg.c in LibTIFF 4.0.7 allows remote attackers to cause a denial of service (memory leak) via a crafted image.,V3.0: 5.5
CVE-2017-7595,2017-04-09T14:59:00.247,The JPEGSetupEncode function in tiff_jpeg.c in LibTIFF 4.0.7 allows remote attackers to cause a denial of service (divide-by-zero error and application crash) via a crafted image.,V3.0: 5.5
CVE-2017-7596,2017-04-09T14:59:00.293,"LibTIFF 4.0.7 has an ""outside the range of representable values of type float"" undefined behavior issue, which might allow remote attackers to cause a denial of service (application crash) or possibly have unspecified other impact via a crafted image.",V3.0: 7.8
CVE-2017-7597,2017-04-09T14:59:00.323,"tif_dirread.c in LibTIFF 4.0.7 has an ""outside the range of representable values of type float"" undefined behavior issue, which might allow remote attackers to cause a denial of service (application crash) or possibly have unspecified other impact via a crafted image.",V3.0: 7.8
CVE-2017-7598,2017-04-09T14:59:00.357,tif_dirread.c in LibTIFF 4.0.7 might allow remote attackers to cause a denial of service (divide-by-zero error and application crash) via a crafted image.,V3.0: 7.8
CVE-2017-7599,2017-04-09T14:59:00.387,"LibTIFF 4.0.7 has an ""outside the range of representable values of type short"" undefined behavior issue, which might allow remote attackers to cause a denial of service (application crash) or possibly have unspecified other impact via a crafted image.",V3.0: 7.8
CVE-2017-7600,2017-04-09T14:59:00.417,"LibTIFF 4.0.7 has an ""outside the range of representable values of type unsigned char"" undefined behavior issue, which might allow remote attackers to cause a denial of service (application crash) or possibly have unspecified other impact via a crafted image.",V3.0: 7.8
CVE-2017-7601,2017-04-09T14:59:00.433,"LibTIFF 4.0.7 has a ""shift exponent too large for 64-bit type long"" undefined behavior issue, which might allow remote attackers to cause a denial of service (application crash) or possibly have unspecified other impact via a crafted image.",V3.0: 7.8
CVE-2017-7602,2017-04-09T14:59:00.467,"LibTIFF 4.0.7 has a signed integer overflow, which might allow remote attackers to cause a denial of service (application crash) or possibly have unspecified other impact via a crafted image.",V3.0: 7.8
CVE-2016-5322,2017-04-11T18:59:00.387,The setByteArray function in tif_dir.c in libtiff 4.0.6 and earlier allows remote attackers to cause a denial of service (out-of-bounds read) via a crafted tiff image.,V3.0: 5.5
CVE-2016-10371,2017-05-10T05:29:00.160,The TIFFWriteDirectoryTagCheckedRational function in tif_dirwrite.c in LibTIFF 4.0.6 allows remote attackers to cause a denial of service (assertion failure and application exit) via a crafted TIFF file.,V3.0: 5.5
CVE-2017-9117,2017-05-21T19:29:00.187,"In LibTIFF 4.0.7, the program processes BMP images without verifying that biWidth and biHeight in the bitmap-information header match the actual input, leading to a heap-based buffer over-read in bmp2tiff.",V3.0: 9.8
CVE-2017-9147,2017-05-22T18:29:00.253,"LibTIFF 4.0.7 has an invalid read in the _TIFFVGetField function in tif_dir.c, which might allow remote attackers to cause a denial of service (crash) via a crafted TIFF file.",V3.0: 6.5
CVE-2017-9403,2017-06-02T19:29:00.167,"In LibTIFF 4.0.7, a memory leak vulnerability was found in the function TIFFReadDirEntryLong8Array in tif_dirread.c, which allows attackers to cause a denial of service via a crafted file.",V3.0: 6.5
CVE-2017-9404,2017-06-02T19:29:00.213,"In LibTIFF 4.0.7, a memory leak vulnerability was found in the function OJPEGReadHeaderInfoSecTablesQTable in tif_ojpeg.c, which allows attackers to cause a denial of service via a crafted file.",V3.0: 6.5
CVE-2017-9815,2017-06-22T15:29:00.173,"In LibTIFF 4.0.7, the TIFFReadDirEntryLong8Array function in libtiff/tif_dirread.c mishandles a malloc operation, which allows attackers to cause a denial of service (memory leak within the function _TIFFmalloc in tif_unix.c) via a crafted file.",V3.0: 6.5
CVE-2017-9935,2017-06-26T12:29:00.187,"In LibTIFF 4.0.8, there is a heap-based buffer overflow in the t2p_write_pdf function in tools/tiff2pdf.c. This heap overflow could lead to different damages. For example, a crafted TIFF document can lead to an out-of-bounds read in TIFFCleanup, an invalid free in TIFFClose or t2p_free, memory corruption in t2p_readwrite_pdf_image, or a double free in t2p_free. Given these possibilities, it probably could cause arbitrary code execution.",V3.0: 8.8
CVE-2017-9936,2017-06-26T12:29:00.220,"In LibTIFF 4.0.8, there is a memory leak in tif_jbig.c. A crafted TIFF document can lead to a memory leak resulting in a remote denial of service attack.",V3.0: 6.5
CVE-2017-9937,2017-06-26T12:29:00.250,"In LibTIFF 4.0.8, there is a memory malloc failure in tif_jbig.c. A crafted TIFF document can lead to an abort resulting in a remote denial of service attack.",V3.0: 6.5
CVE-2014-8127,2017-06-26T15:29:00.237,"LibTIFF 4.0.3 allows remote attackers to cause a denial of service (out-of-bounds read and crash) via a crafted TIFF image to the (1) checkInkNamesString function in tif_dir.c in the thumbnail tool, (2) compresscontig function in tiff2bw.c in the tiff2bw tool, (3) putcontig8bitCIELab function in tif_getimage.c in the tiff2rgba tool, LZWPreDecode function in tif_lzw.c in the (4) tiff2ps or (5) tiffdither tool, (6) NeXTDecode function in tif_next.c in the tiffmedian tool, or (7) TIFFWriteDirectoryTagLongLong8Array function in tif_dirwrite.c in the tiffset tool.",V3.0: 6.5
CVE-2017-10688,2017-06-29T23:29:00.347,"In LibTIFF 4.0.8, there is a assertion abort in the TIFFWriteDirectoryTagCheckedLong8Array function in tif_dirwrite.c. A crafted input will lead to a remote denial of service attack.",V3.0: 7.5
CVE-2017-11335,2017-07-17T13:18:20.267,"There is a heap based buffer overflow in tools/tiff2pdf.c of LibTIFF 4.0.8 via a PlanarConfig=Contig image, which causes a more than one hundred bytes out-of-bounds write (related to the ZIPDecode function in tif_zip.c). A crafted input may lead to a remote denial of service attack or an arbitrary code execution attack.",V3.0: 8.8
CVE-2017-11613,2017-07-26T08:29:00.197,"In LibTIFF 4.0.8, there is a denial of service vulnerability in the TIFFOpen function. A crafted input will lead to a denial of service attack. During the TIFFOpen process, td_imagelength is not checked. The value of td_imagelength can be directly controlled by an input file. In the ChopUpSingleUncompressedStrip function, the _TIFFCheckMalloc function is called based on td_imagelength. If we set the value of td_imagelength close to the amount of system memory, it will hang the system or trigger the OOM killer.",V3.0: 6.5
CVE-2017-12944,2017-08-18T15:29:00.247,"The TIFFReadDirEntryArray function in tif_read.c in LibTIFF 4.0.8 mishandles memory allocation for short files, which allows remote attackers to cause a denial of service (allocation failure and application crash) in the TIFFFetchStripThing function in tif_dirread.c during a tiff2pdf invocation.",V3.0: 7.5
CVE-2017-13726,2017-08-29T06:29:00.237,"There is a reachable assertion abort in the function TIFFWriteDirectorySec() in LibTIFF 4.0.8, related to tif_dirwrite.c and a SubIFD tag. A crafted input will lead to a remote denial of service attack.",V3.0: 6.5
CVE-2017-13727,2017-08-29T06:29:00.267,"There is a reachable assertion abort in the function TIFFWriteDirectoryTagSubifd() in LibTIFF 4.0.8, related to tif_dirwrite.c and a SubIFD tag. A crafted input will lead to a remote denial of service attack.",V3.0: 6.5
CVE-2017-14528,2017-09-18T00:29:00.190,"The TIFFSetProfiles function in coders/tiff.c in ImageMagick 7.0.6 has incorrect expectations about whether LibTIFF TIFFGetField return values imply that data validation has occurred, which allows remote attackers to cause a denial of service (use-after-free after an invalid call to TIFFSetField, and application crash) via a crafted file.",V3.1: 6.5
CVE-2017-17095,2017-12-02T06:29:00.377,tools/pal2rgb.c in pal2rgb in LibTIFF 4.0.9 allows remote attackers to cause a denial of service (TIFFSetupStrips heap-based buffer overflow and application crash) or possibly have unspecified other impact via a crafted TIFF file.,V3.0: 8.8
CVE-2017-17942,2017-12-28T06:29:00.537,"In LibTIFF 4.0.9, there is a heap-based buffer over-read in the function PackBitsEncode in tif_packbits.c.",V3.0: 8.8
CVE-2017-17973,2017-12-29T21:29:00.190,"** DISPUTED ** In LibTIFF 4.0.8, there is a heap-based use-after-free in the t2p_writeproc function in tiff2pdf.c. NOTE: there is a third-party report of inability to reproduce this issue.",V3.0: 8.8
CVE-2017-18013,2018-01-01T08:29:00.470,"In LibTIFF 4.0.9, there is a Null-Pointer Dereference in the tif_print.c TIFFPrintDirectory function, as demonstrated by a tiffinfo crash.",V3.0: 6.5
CVE-2018-5360,2018-01-14T02:29:04.667,"LibTIFF before 4.0.6 mishandles the reading of TIFF files, as demonstrated by a heap-based buffer over-read in the ReadTIFFImage function in coders/tiff.c in GraphicsMagick 1.3.27.",V3.0: 8.8
CVE-2018-5784,2018-01-19T08:29:00.320,"In LibTIFF 4.0.9, there is an uncontrolled resource consumption in the TIFFSetDirectory function of tif_dir.c. Remote attackers could leverage this vulnerability to cause a denial of service via a crafted tif file. This occurs because the declared number of directory entries is not validated against the actual number of directory entries.",V3.0: 6.5
CVE-2018-7456,2018-02-24T06:29:00.630,"A NULL Pointer Dereference occurs in the function TIFFPrintDirectory in tif_print.c in LibTIFF 3.9.3, 3.9.4, 3.9.5, 3.9.6, 3.9.7, 4.0.0alpha4, 4.0.0alpha5, 4.0.0alpha6, 4.0.0beta7, 4.0.0, 4.0.1, 4.0.2, 4.0.3, 4.0.4, 4.0.4beta, 4.0.5, 4.0.6, 4.0.7, 4.0.8 and 4.0.9 when using the tiffinfo tool to print crafted TIFF information, a different vulnerability than CVE-2017-18013. (This affects an earlier part of the TIFFPrintDirectory function that was not addressed by the CVE-2017-18013 patch.)",V3.0: 6.5
CVE-2014-8129,2018-03-12T02:29:00.197,"LibTIFF 4.0.3 allows remote attackers to cause a denial of service (out-of-bounds write) or possibly have unspecified other impact via a crafted TIFF image, as demonstrated by failure of tif_next.c to verify that the BitsPerSample value is 2, and the t2p_sample_lab_signed_to_unsigned function in tiff2pdf.c.",V3.0: 8.8
CVE-2014-8130,2018-03-12T02:29:00.307,"The _TIFFmalloc function in tif_unix.c in LibTIFF 4.0.3 does not reject a zero size, which allows remote attackers to cause a denial of service (divide-by-zero error and application crash) via a crafted TIFF image that is mishandled by the TIFFWriteScanline function in tif_write.c, as demonstrated by tiffdither.",V3.0: 6.5
CVE-2016-5314,2018-03-12T02:29:00.400,"Buffer overflow in the PixarLogDecode function in tif_pixarlog.c in LibTIFF 4.0.6 and earlier allows remote attackers to cause a denial of service (application crash) or possibly have unspecified other impact via a crafted TIFF image, as demonstrated by overwriting the vgetparent function pointer with rgb2ycbcr.",V3.0: 8.8
CVE-2018-8905,2018-03-22T04:29:00.483,"In LibTIFF 4.0.9, a heap-based buffer overflow occurs in the function LZWDecodeCompat in tif_lzw.c via a crafted TIFF file, as demonstrated by tiff2ps.",V3.1: 8.8
CVE-2018-10126,2018-04-21T21:29:00.290,LibTIFF 4.0.9 has a NULL pointer dereference in the jpeg_fdct_16x16 function in jfdctint.c.,V3.1: 6.5
CVE-2018-10779,2018-05-07T07:29:00.537,"TIFFWriteScanline in tif_write.c in LibTIFF 3.8.2 has a heap-based buffer over-read, as demonstrated by bmp2tiff.",V3.0: 6.5
CVE-2018-10801,2018-05-08T06:29:00.203,"TIFFClientOpen in tif_unix.c in LibTIFF 3.8.2 has memory leaks, as demonstrated by bmp2tiff.",V3.0: 6.5
CVE-2018-10963,2018-05-10T02:29:00.607,"The TIFFWriteDirectorySec() function in tif_dirwrite.c in LibTIFF through 4.0.9 allows remote attackers to cause a denial of service (assertion failure and application crash) via a crafted file, a different vulnerability than CVE-2017-13726.",V3.0: 6.5
CVE-2018-11555,2018-05-30T04:29:00.393,"** DISPUTED ** tificc in Little CMS 2.9 has an out-of-bounds write in the PrecalculatedXFORM function in cmsxform.c in liblcms2.a via a crafted TIFF file. NOTE: Little CMS developers do consider this a vulnerability because the issue is based on an sample program using LIBTIFF and do not apply to the lcms2 library, lcms2 does not depends on LIBTIFF other than to build sample programs, and the issue cannot be reproduced on the lcms2 library..",V3.0: 7.8
CVE-2018-11556,2018-05-30T04:29:00.457,"** DISPUTED ** tificc in Little CMS 2.9 has an out-of-bounds write in the cmsPipelineCheckAndRetreiveStages function in cmslut.c in liblcms2.a via a crafted TIFF file. NOTE: Little CMS developers do consider this a vulnerability because the issue is based on an sample program using LIBTIFF and do not apply to the lcms2 library, lcms2 does not depends on LIBTIFF other than to build sample programs, and the issue cannot be reproduced on the lcms2 library..",V3.0: 7.8
CVE-2018-12900,2018-06-26T22:29:00.257,"Heap-based buffer overflow in the cpSeparateBufToContigBuf function in tiffcp.c in LibTIFF 3.9.3, 3.9.4, 3.9.5, 3.9.6, 3.9.7, 4.0.0beta7, 4.0.0alpha4, 4.0.0alpha5, 4.0.0alpha6, 4.0.0, 4.0.1, 4.0.2, 4.0.3, 4.0.4, 4.0.4beta, 4.0.5, 4.0.6, 4.0.7, 4.0.8 and 4.0.9 allows remote attackers to cause a denial of service (crash) or possibly have unspecified other impact via a crafted TIFF file.",V3.0: 8.8
CVE-2018-15209,2018-08-08T04:29:00.477,"ChopUpSingleUncompressedStrip in tif_dirread.c in LibTIFF 4.0.9 allows remote attackers to cause a denial of service (heap-based buffer overflow and application crash) or possibly have unspecified other impact via a crafted TIFF file, as demonstrated by tiff2pdf.",V3.0: 8.8
