CVE ID,Published,Description,Base Score
CVE-2004-0804,2004-11-03T05:00:00.000,"Vulnerability in tif_dirread.c for libtiff allows remote attackers to cause a denial of service (application crash) via a TIFF image that causes a divide-by-zero error when the number of row bytes is zero, a different vulnerability than CVE-2005-2452.",V2: 4.3
CVE-2004-1307,2004-12-21T05:00:00.000,"Integer overflow in the TIFFFetchStripThing function in tif_dirread.c for libtiff 3.6.1 allows remote attackers to execute arbitrary code via a TIFF file with the STRIPOFFSETS flag and a large number of strips, which causes a zero byte buffer to be allocated and leads to a heap-based buffer overflow.",V2: 7.5
CVE-2004-0803,2004-12-23T05:00:00.000,"Multiple vulnerabilities in the RLE (run length encoding) decoders for libtiff 3.6.1 and earlier, related to buffer overflows and integer overflows, allow remote attackers to execute arbitrary code via TIFF files.",V2: 7.5
CVE-2004-1183,2005-01-06T05:00:00.000,Integer overflow in the tiffdump utility for libtiff 3.7.1 and earlier allows remote attackers to cause a denial of service (application crash) and possibly execute arbitrary code via a crafted TIFF file.,V2: 5.1
CVE-2004-1308,2005-01-10T05:00:00.000,"Integer overflow in (1) tif_dirread.c and (2) tif_fax3.c for libtiff 3.5.7 and 3.7.0 allows remote attackers to execute arbitrary code via a TIFF file containing a TIFF_ASCII or TIFF_UNDEFINED directory entry with a -1 entry count, which leads to a heap-based buffer overflow.",V2: 10.0
CVE-2004-0886,2005-01-27T05:00:00.000,Multiple integer overflows in libtiff 3.6.1 and earlier allow remote attackers to cause a denial of service (crash or memory corruption) via TIFF images that lead to incorrect malloc calls.,V2: 5.0
CVE-2004-0929,2005-01-27T05:00:00.000,"Heap-based buffer overflow in the OJPEGVSetField function in tif_ojpeg.c for libtiff 3.6.1 and earlier, when compiled with the OJPEG_SUPPORT (old JPEG support) option, allows remote attackers to execute arbitrary code via a malformed TIFF image.",V2: 10.0
CVE-2005-1544,2005-05-14T04:00:00.000,Stack-based buffer overflow in libTIFF before 3.7.2 allows remote attackers to execute arbitrary code via a TIFF file with a malformed BitsPerSample tag.,V2: 7.5
CVE-2005-2452,2005-08-03T04:00:00.000,"libtiff up to 3.7.0 allows remote attackers to cause a denial of service (application crash) via a TIFF image header with a zero ""YCbCr subsampling"" value, which causes a divide-by-zero error in (1) tif_strip.c and (2) tif_tile.c, a different vulnerability than CVE-2004-0804.",V2: 5.0
CVE-2006-0405,2006-01-25T02:03:00.000,"The TIFFFetchShortPair function in tif_dirread.c in libtiff 3.8.0 allows remote attackers to cause a denial of service (application crash) via a crafted TIFF image that triggers a NULL pointer dereference, possibly due to changes in type declarations and/or the TIFFVSetField function.",V2: 5.0
CVE-2006-2024,2006-04-25T23:02:00.000,"Multiple vulnerabilities in libtiff before 3.8.1 allow context-dependent attackers to cause a denial of service via a TIFF image that triggers errors in (1) the TIFFFetchAnyArray function in (a) tif_dirread.c; (2) certain ""codec cleanup methods"" in (b) tif_lzw.c, (c) tif_pixarlog.c, and (d) tif_zip.c; (3) and improper restoration of setfield and getfield methods in cleanup functions within (e) tif_jpeg.c, tif_pixarlog.c, (f) tif_fax3.c, and tif_zip.c.",V2: 4.0
CVE-2006-2025,2006-04-25T23:02:00.000,Integer overflow in the TIFFFetchData function in tif_dirread.c for libtiff before 3.8.1 allows context-dependent attackers to cause a denial of service and possibly execute arbitrary code via a crafted TIFF image.,V2: 6.5
CVE-2006-2026,2006-04-25T23:02:00.000,"Double free vulnerability in tif_jpeg.c in libtiff before 3.8.1 allows context-dependent attackers to cause a denial of service (crash) and possibly execute arbitrary code via a crafted TIFF image that triggers errors related to ""setfield/getfield methods in cleanup functions.""",V2: 6.5
CVE-2006-2120,2006-05-01T22:06:00.000,"The TIFFToRGB function in libtiff before 3.8.1 allows remote attackers to cause a denial of service (crash) via a crafted TIFF image with Yr/Yg/Yb values that exceed the YCR/YCG/YCB values, which triggers an out-of-bounds read.",V2: 2.1
CVE-2006-2656,2006-05-30T18:02:00.000,"Stack-based buffer overflow in the tiffsplit command in libtiff 3.8.2 and earlier might might allow attackers to execute arbitrary code via a long filename. NOTE: tiffsplit is not setuid. If there is not a common scenario under which tiffsplit is called with attacker-controlled command line arguments, then perhaps this issue should not be included in CVE.",V2: 7.5
CVE-2006-2193,2006-06-08T19:06:00.000,"Buffer overflow in the t2p_write_pdf_string function in tiff2pdf in libtiff 3.8.2 and earlier allows attackers to cause a denial of service (crash) and possibly execute arbitrary code via a TIFF file with a DocumentName tag that contains UTF-8 characters, which triggers the overflow when a character is sign extended to an integer that produces more digits than expected in an sprintf call.",V2: 7.5
CVE-2006-3459,2006-08-03T01:04:00.000,"Multiple stack-based buffer overflows in the TIFF library (libtiff) before 3.8.2, as used in Adobe Reader 9.3.0 and other products, allow context-dependent attackers to execute arbitrary code or cause a denial of service via unspecified vectors, including a large tdir_count value in the TIFFFetchShortPair function in tif_dirread.c.",V2: 7.5
CVE-2006-3460,2006-08-03T01:04:00.000,Heap-based buffer overflow in the JPEG decoder in the TIFF library (libtiff) before 3.8.2 allows context-dependent attackers to cause a denial of service and possibly execute arbitrary code via an encoded JPEG stream that is longer than the scan line size (TiffScanLineSize).,V2: 7.5
CVE-2006-3461,2006-08-03T01:04:00.000,Heap-based buffer overflow in the PixarLog decoder in the TIFF library (libtiff) before 3.8.2 might allow context-dependent attackers to execute arbitrary code via unknown vectors.,V2: 7.5
CVE-2006-3462,2006-08-03T01:04:00.000,Heap-based buffer overflow in the NeXT RLE decoder in the TIFF library (libtiff) before 3.8.2 might allow context-dependent attackers to execute arbitrary code via unknown vectors involving decoding large RLE images.,V2: 7.5
CVE-2006-3463,2006-08-03T01:04:00.000,"The EstimateStripByteCounts function in TIFF library (libtiff) before 3.8.2 uses a 16-bit unsigned short when iterating over an unsigned 32-bit value, which allows context-dependent attackers to cause a denial of service via a large td_nstrips value, which triggers an infinite loop.",V2: 7.8
CVE-2006-3464,2006-08-03T01:04:00.000,"TIFF library (libtiff) before 3.8.2 allows context-dependent attackers to pass numeric range checks and possibly execute code, and trigger assert errors, via large offset values in a TIFF directory that lead to an integer overflow and other unspecified vectors involving ""unchecked arithmetic operations"".",V2: 7.5
CVE-2006-3465,2006-08-03T01:04:00.000,Unspecified vulnerability in the custom tag support for the TIFF library (libtiff) before 3.8.2 allows remote attackers to cause a denial of service (instability or crash) and execute arbitrary code via unknown vectors.,V2: 7.5
CVE-2006-4507,2006-08-31T23:04:00.000,"Unspecified vulnerability in the TIFF viewer (possibly libTIFF) in the Photo Viewer in the Sony PlaystationPortable (PSP) 2.00 through 2.80 allows local users to execute arbitrary code via crafted TIFF images. NOTE: due to lack of details, it is not clear whether this is related to other issues such as CVE-2006-3464 or CVE-2006-3465.",V2: 4.6
CVE-2008-2327,2008-08-27T20:41:00.000,"Multiple buffer underflows in the (1) LZWDecode, (2) LZWDecodeCompat, and (3) LZWDecodeVector functions in tif_lzw.c in the LZW decoder in LibTIFF 3.8.2 and earlier allow context-dependent attackers to execute arbitrary code via a crafted TIFF file, related to improper handling of the CODE_CLEAR code.",V2: 6.8
CVE-2009-2285,2009-07-01T13:00:01.750,"Buffer underflow in the LZWDecodeCompat function in libtiff 3.8.2 allows context-dependent attackers to cause a denial of service (crash) via a crafted TIFF image, a different vulnerability than CVE-2008-2327.",V2: 4.3
CVE-2009-2347,2009-07-14T20:30:00.377,"Multiple integer overflows in inter-color spaces conversion tools in libtiff 3.8 through 3.8.2, 3.9, and 4.0 allow context-dependent attackers to execute arbitrary code via a TIFF image with large (1) width and (2) height values, which triggers a heap-based buffer overflow in the (a) cvt_whole_image function in tiff2rgba and (b) tiffcvt function in rgb2ycbcr.",V2: 9.3
CVE-2010-1411,2010-06-17T16:30:01.810,"Multiple integer overflows in the Fax3SetupState function in tif_fax3.c in the FAX3 decoder in LibTIFF before 3.9.3, as used in ImageIO in Apple Mac OS X 10.5.8 and Mac OS X 10.6 before 10.6.4, allow remote attackers to execute arbitrary code or cause a denial of service (application crash) via a crafted TIFF file that triggers a heap-based buffer overflow.",V2: 6.8
CVE-2010-2065,2010-06-24T12:30:01.813,Integer overflow in the TIFFroundup macro in LibTIFF before 3.9.3 allows remote attackers to cause a denial of service (application crash) or possibly execute arbitrary code via a crafted TIFF file that triggers a buffer overflow.,V2: 6.8
CVE-2010-2067,2010-06-24T12:30:01.843,Stack-based buffer overflow in the TIFFFetchSubjectDistance function in tif_dirread.c in LibTIFF before 3.9.4 allows remote attackers to cause a denial of service (application crash) or possibly execute arbitrary code via a long EXIF SubjectDistance field in a TIFF file.,V2: 6.8
CVE-2010-2443,2010-06-24T17:30:01.233,"The OJPEGReadBufferFill function in tif_ojpeg.c in LibTIFF before 3.9.3 allows remote attackers to cause a denial of service (NULL pointer dereference and application crash) via an OJPEG image with undefined strip offsets, related to the TIFFVGetField function.",V2: 5.0
CVE-2010-2233,2010-07-02T12:43:52.937,"tif_getimage.c in LibTIFF 3.9.0 and 3.9.2 on 64-bit platforms, as used in ImageMagick, does not properly perform vertical flips, which allows remote attackers to cause a denial of service (application crash) or possibly execute arbitrary code via a crafted TIFF image, related to ""downsampled OJPEG input.""",V2: 7.5
CVE-2010-2595,2010-07-02T12:43:53.000,"The TIFFYCbCrtoRGB function in LibTIFF 3.9.0 and 3.9.2, as used in ImageMagick, does not properly handle invalid ReferenceBlackWhite values, which allows remote attackers to cause a denial of service (application crash) via a crafted TIFF image that triggers an array index error, related to ""downsampled OJPEG input.""",V2: 4.3
CVE-2010-2596,2010-07-02T12:43:53.033,"The OJPEGPostDecode function in tif_ojpeg.c in LibTIFF 3.9.0 and 3.9.2, as used in tiff2ps, allows remote attackers to cause a denial of service (assertion failure and application exit) via a crafted TIFF image, related to ""downsampled OJPEG input.""",V2: 4.3
CVE-2010-2597,2010-07-02T12:43:53.063,"The TIFFVStripSize function in tif_strip.c in LibTIFF 3.9.0 and 3.9.2 makes incorrect calls to the TIFFGetField function, which allows remote attackers to cause a denial of service (application crash) via a crafted TIFF image, related to ""downsampled OJPEG input"" and possibly related to a compiler optimization that triggers a divide-by-zero error.",V2: 4.3
CVE-2010-2598,2010-07-02T12:43:53.080,"LibTIFF in Red Hat Enterprise Linux (RHEL) 3 on x86_64 platforms, as used in tiff2rgba, attempts to process image data even when the required compression functionality is not configured, which allows remote attackers to cause a denial of service via a crafted TIFF image, related to ""downsampled OJPEG input.""",V2: 4.3
CVE-2010-2481,2010-07-06T17:17:13.390,"The TIFFExtractData macro in LibTIFF before 3.9.4 does not properly handle unknown tag types in TIFF directory entries, which allows remote attackers to cause a denial of service (out-of-bounds read and application crash) via a crafted TIFF file.",V2: 4.3
CVE-2010-2482,2010-07-06T17:17:13.437,"LibTIFF 3.9.4 and earlier does not properly handle an invalid td_stripbytecount field, which allows remote attackers to cause a denial of service (NULL pointer dereference and application crash) via a crafted TIFF file, a different vulnerability than CVE-2010-2443.",V2: 4.3
CVE-2010-2483,2010-07-06T17:17:13.467,The TIFFRGBAImageGet function in LibTIFF 3.9.0 allows remote attackers to cause a denial of service (out-of-bounds read and application crash) via a TIFF file with an invalid combination of SamplesPerPixel and Photometric values.,V2: 4.3
CVE-2010-2630,2010-07-06T17:17:20.110,"The TIFFReadDirectory function in LibTIFF 3.9.0 does not properly validate the data types of codec-specific tags that have an out-of-order position in a TIFF file, which allows remote attackers to cause a denial of service (application crash) via a crafted file, a different vulnerability than CVE-2010-2481.",V2: 4.3
CVE-2010-2631,2010-07-06T17:17:20.140,"LibTIFF 3.9.0 ignores tags in certain situations during the first stage of TIFF file processing and does not properly handle this during the second stage, which allows remote attackers to cause a denial of service (application crash) via a crafted file, a different vulnerability than CVE-2010-2481.",V2: 4.3
CVE-2010-3087,2010-09-28T18:00:03.090,LibTIFF before 3.9.2-5.2.1 in SUSE openSUSE 11.3 allows remote attackers to cause a denial of service (memory corruption) or possibly execute arbitrary code via a crafted TIFF image.,V2: 6.8
CVE-2011-0191,2011-03-03T20:00:02.627,"Buffer overflow in LibTIFF 3.9.4 and possibly other versions, as used in ImageIO in Apple iTunes before 10.2 on Windows and other products, allows remote attackers to execute arbitrary code or cause a denial of service (application crash) via a crafted TIFF image with JPEG encoding.",V2: 9.3
CVE-2011-0192,2011-03-03T20:00:02.643,"Buffer overflow in Fax4Decode in LibTIFF 3.9.4 and possibly other versions, as used in ImageIO in Apple iTunes before 10.2 on Windows and other products, allows remote attackers to execute arbitrary code or cause a denial of service (application crash) via a crafted TIFF Internet Fax image file that has been compressed using CCITT Group 4 encoding, related to the EXPAND2D macro in libtiff/tif_fax3.h.  NOTE: some of these details are obtained from third party information.",V2: 9.3
CVE-2011-1167,2011-03-28T16:55:04.763,Heap-based buffer overflow in the thunder (aka ThunderScan) decoder in tif_thunder.c in LibTIFF 3.9.4 and earlier allows remote attackers to execute arbitrary code via crafted THUNDER_2BITDELTAS data in a .tiff file that has an unexpected BitsPerSample value.,V2: 6.8
CVE-2009-5022,2011-05-03T20:55:04.510,Heap-based buffer overflow in tif_ojpeg.c in the OJPEG decoder in LibTIFF before 3.9.5 allows remote attackers to execute arbitrary code via a crafted TIFF file.,V2: 6.8
CVE-2010-4665,2011-05-03T20:55:04.573,Integer overflow in the ReadDirectory function in tiffdump.c in tiffdump in LibTIFF before 3.9.5 allows remote attackers to cause a denial of service (application crash) or possibly have unspecified other impact via a crafted TIFF file containing a directory data structure with many directory entries.,V2: 4.3
CVE-2012-1173,2012-06-04T20:55:03.447,"Multiple integer overflows in tiff_getimage.c in LibTIFF 3.9.4 allow remote attackers to execute arbitrary code via a crafted tile size in a TIFF file, which is not properly handled by the (1) gtTileSeparate or (2) gtStripSeparate function, leading to a heap-based buffer overflow.",V2: 6.8
CVE-2012-2088,2012-07-22T17:55:01.210,"Integer signedness error in the TIFFReadDirectory function in tif_dirread.c in libtiff 3.9.4 and earlier allows remote attackers to cause a denial of service (application crash) and possibly execute arbitrary code via a negative tile depth in a tiff image, which triggers an improper conversion between signed and unsigned types, leading to a heap-based buffer overflow.",V2: 7.5
CVE-2012-2113,2012-07-22T17:55:01.273,"Multiple integer overflows in tiff2pdf in libtiff before 4.0.2 allow remote attackers to cause a denial of service (application crash) or possibly execute arbitrary code via a crafted tiff image, which triggers a heap-based buffer overflow.",V2: 6.8
CVE-2012-3401,2012-08-13T20:55:08.600,"The t2p_read_tiff_init function in tiff2pdf (tools/tiff2pdf.c) in LibTIFF 4.0.2 and earlier does not properly initialize the T2P context struct pointer in certain error conditions, which allows context-dependent attackers to cause a denial of service (crash) and possibly execute arbitrary code via a crafted TIFF image that triggers a heap-based buffer overflow.",V2: 6.8
CVE-2012-4447,2012-10-28T15:55:01.817,Heap-based buffer overflow in tif_pixarlog.c in LibTIFF before 4.0.3 allows remote attackers to cause a denial of service (application crash) and possibly execute arbitrary code via a crafted TIFF image using the PixarLog Compression format.,V2: 6.8
CVE-2012-5581,2013-01-04T22:55:02.303,Stack-based buffer overflow in tif_dir.c in LibTIFF before 4.0.2 allows remote attackers to cause a denial of service (crash) and possibly execute arbitrary code via a crafted DOTRANGE tag in a TIFF image.,V2: 6.8
CVE-2013-1960,2013-07-03T18:55:00.870,Heap-based buffer overflow in the t2p_process_jpeg_strip function in tiff2pdf in libtiff 4.0.3 and earlier allows remote attackers to cause a denial of service (crash) and possibly execute arbitrary code via a crafted TIFF image file.,V2: 9.3
CVE-2013-1961,2013-07-03T18:55:00.900,Stack-based buffer overflow in the t2p_write_pdf_page function in tiff2pdf in libtiff before 4.0.3 allows remote attackers to cause a denial of service (application crash) via a crafted image length and resolution in a TIFF image file.,V2: 9.3
CVE-2013-4232,2013-09-10T19:55:11.247,Use-after-free vulnerability in the t2p_readwrite_pdf_image function in tools/tiff2pdf.c in libtiff 4.0.3 allows remote attackers to cause a denial of service (crash) or possibly execute arbitrary code via a crafted TIFF image.,V2: 6.8
CVE-2013-4243,2013-09-10T19:55:11.287,Heap-based buffer overflow in the readgifimage function in the gif2tiff tool in libtiff 4.0.3 and earlier allows remote attackers to cause a denial of service (crash) and possibly execute arbitrary code via a crafted height and width values in a GIF image.,V2: 6.8
CVE-2013-4244,2013-09-28T19:55:03.117,The LZW decompressor in the gif2tiff tool in libtiff 4.0.3 and earlier allows context-dependent attackers to cause a denial of service (out-of-bounds write and crash) or possibly execute arbitrary code via a crafted GIF image.,V2: 6.8
CVE-2013-4231,2014-01-19T17:16:28.990,"Multiple buffer overflows in libtiff before 4.0.3 allow remote attackers to cause a denial of service (out-of-bounds write) via a crafted (1) extension block in a GIF image or (2) GIF raster image to tools/gif2tiff.c or (3) a long filename for a TIFF image to tools/rgb2ycbcr.c. NOTE: vectors 1 and 3 are disputed by Red Hat, which states that the input cannot exceed the allocated buffer size.",V2: 4.3
CVE-2014-9330,2015-01-20T15:59:04.423,"Integer overflow in tif_packbits.c in bmp2tif in libtiff 4.0.3 allows remote attackers to cause a denial of service (crash) via crafted BMP image, related to dimensions, which triggers an out-of-bounds read.",V2: 5.0
CVE-2015-7554,2016-01-08T19:59:06.850,The _TIFFVGetField function in tif_dir.c in libtiff 4.0.6 allows attackers to cause a denial of service (invalid memory write and crash) or possibly have unspecified other impact via crafted field data in an extension tag in a TIFF image.,V3.0: 9.8
CVE-2015-8668,2016-01-08T19:59:18.477,Heap-based buffer overflow in the PackBitsPreEncode function in tif_packbits.c in bmp2tiff in libtiff 4.0.6 and earlier allows remote attackers to execute arbitrary code or cause a denial of service via a large width field in a BMP image.,V3.0: 9.8
CVE-2015-8781,2016-02-01T21:59:01.110,"tif_luv.c in libtiff allows attackers to cause a denial of service (out-of-bounds write) via an invalid number of samples per pixel in a LogL compressed TIFF image, a different vulnerability than CVE-2015-8782.",V3.1: 6.5
CVE-2015-8782,2016-02-01T21:59:02.110,"tif_luv.c in libtiff allows attackers to cause a denial of service (out-of-bounds writes) via a crafted TIFF image, a different vulnerability than CVE-2015-8781.",V3.1: 6.5
CVE-2015-8783,2016-02-01T21:59:03.063,tif_luv.c in libtiff allows attackers to cause a denial of service (out-of-bounds reads) via a crafted TIFF image.,V3.1: 6.5
CVE-2016-0740,2016-04-13T16:59:01.377,Buffer overflow in the ImagingLibTiffDecode function in libImaging/TiffDecode.c in Pillow before 3.1.1 allows remote attackers to overwrite memory via a crafted TIFF file.,V3.0: 6.5
CVE-2014-9655,2016-04-13T17:59:00.113,"The (1) putcontig8bitYCbCr21tile function in tif_getimage.c or (2) NeXTDecode function in tif_next.c in LibTIFF allows remote attackers to cause a denial of service (uninitialized memory access) via a crafted TIFF image, as demonstrated by libtiff-cvs-1.tif and libtiff-cvs-2.tif.",V3.0: 6.5
CVE-2015-1547,2016-04-13T17:59:01.800,"The NeXTDecode function in tif_next.c in LibTIFF allows remote attackers to cause a denial of service (uninitialized memory access) via a crafted TIFF image, as demonstrated by libtiff5.tif.",V3.0: 6.5
CVE-2015-8665,2016-04-13T17:59:04.350,tif_getimage.c in LibTIFF 4.0.6 allows remote attackers to cause a denial of service (out-of-bounds read) via the SamplesPerPixel tag in a TIFF image.,V3.0: 5.5
CVE-2015-8683,2016-04-13T17:59:05.523,The putcontig8bitCIELab function in tif_getimage.c in LibTIFF 4.0.6 allows remote attackers to cause a denial of service (out-of-bounds read) via a packed TIFF image.,V3.0: 5.5
CVE-2015-8784,2016-04-13T17:59:06.490,"The NeXTDecode function in tif_next.c in LibTIFF allows remote attackers to cause a denial of service (out-of-bounds write) via a crafted TIFF image, as demonstrated by libtiff5.tif.",V3.1: 6.5
CVE-2016-3186,2016-04-19T14:59:01.157,Buffer overflow in the readextension function in gif2tiff.c in LibTIFF 4.0.6 allows remote attackers to cause a denial of service (application crash) via a crafted GIF file.,V3.0: 6.2
CVE-2016-3632,2016-09-21T18:59:00.160,The _TIFFVGetField function in tif_dirinfo.c in LibTIFF 4.0.6 and earlier allows remote attackers to cause a denial of service (out-of-bounds write) or execute arbitrary code via a crafted TIFF image.,V3.0: 7.8
CVE-2016-3945,2016-09-21T18:59:01.677,"Multiple integer overflows in the (1) cvt_by_strip and (2) cvt_by_tile functions in the tiff2rgba tool in LibTIFF 4.0.6 and earlier, when -b mode is enabled, allow remote attackers to cause a denial of service (crash) or execute arbitrary code via a crafted TIFF image, which triggers an out-of-bounds write.",V3.0: 7.8
CVE-2016-3990,2016-09-21T18:59:02.833,Heap-based buffer overflow in the horizontalDifference8 function in tif_pixarlog.c in LibTIFF 4.0.6 and earlier allows remote attackers to cause a denial of service (crash) or execute arbitrary code via a crafted TIFF image to tiffcp.,V3.0: 7.8
CVE-2016-3991,2016-09-21T18:59:03.863,Heap-based buffer overflow in the loadImage function in the tiffcrop tool in LibTIFF 4.0.6 and earlier allows remote attackers to cause a denial of service (out-of-bounds write) or execute arbitrary code via a crafted TIFF image with zero tiles.,V3.0: 7.8
CVE-2016-3619,2016-10-03T16:09:00.180,"The DumpModeEncode function in tif_dumpmode.c in the bmp2tiff tool in LibTIFF 4.0.6 and earlier, when the ""-c none"" option is used, allows remote attackers to cause a denial of service (buffer over-read) via a crafted BMP image.",V3.0: 6.5
CVE-2016-3620,2016-10-03T16:09:01.727,"The ZIPEncode function in tif_zip.c in the bmp2tiff tool in LibTIFF 4.0.6 and earlier, when the ""-c zip"" option is used, allows remote attackers to cause a denial of service (buffer over-read) via a crafted BMP image.",V3.0: 7.5
CVE-2016-3621,2016-10-03T16:09:02.897,"The LZWEncode function in tif_lzw.c in the bmp2tiff tool in LibTIFF 4.0.6 and earlier, when the ""-c lzw"" option is used, allows remote attackers to cause a denial of service (buffer over-read) via a crafted BMP image.",V3.0: 8.8
CVE-2016-3622,2016-10-03T16:09:04.133,The fpAcc function in tif_predict.c in the tiff2rgba tool in LibTIFF 4.0.6 and earlier allows remote attackers to cause a denial of service (divide-by-zero error) via a crafted TIFF image.,V3.0: 6.5
CVE-2016-3623,2016-10-03T16:09:05.557,The rgb2ycbcr tool in LibTIFF 4.0.6 and earlier allows remote attackers to cause a denial of service (divide-by-zero) by setting the (1) v or (2) h parameter to 0.,V3.0: 7.5
CVE-2016-3624,2016-10-03T16:09:06.790,"The cvtClump function in the rgb2ycbcr tool in LibTIFF 4.0.6 and earlier allows remote attackers to cause a denial of service (out-of-bounds write) by setting the ""-v"" option to -1.",V3.0: 7.5
CVE-2016-3625,2016-10-03T16:09:07.977,tif_read.c in the tiff2bw tool in LibTIFF 4.0.6 and earlier allows remote attackers to cause a denial of service (out-of-bounds read) via a crafted TIFF image.,V3.0: 6.5
CVE-2016-3631,2016-10-03T16:09:09.070,The (1) cpStrips and (2) cpTiles functions in the thumbnail tool in LibTIFF 4.0.6 and earlier allow remote attackers to cause a denial of service (out-of-bounds read) via vectors related to the bytecounts[] array variable.,V3.0: 7.5
CVE-2016-3633,2016-10-03T16:09:10.463,The setrow function in the thumbnail tool in LibTIFF 4.0.6 and earlier allows remote attackers to cause a denial of service (out-of-bounds read) via vectors related to the src variable.,V3.0: 7.5
