CVE ID,Published,Description,Base Score
CVE-2018-16335,2018-09-02T03:29:00.870,"newoffsets handling in ChopUpSingleUncompressedStrip in tif_dirread.c in LibTIFF 4.0.9 allows remote attackers to cause a denial of service (heap-based buffer overflow and application crash) or possibly have unspecified other impact via a crafted TIFF file, as demonstrated by tiff2pdf. This is a different vulnerability than CVE-2018-15209.",V3.0: 8.8
CVE-2018-17000,2018-09-13T16:29:01.263,A NULL pointer dereference in the function _TIFFmemcmp at tif_unix.c (called from TIFFWriteDirectoryTagTransferfunction) in LibTIFF 4.0.9 allows an attacker to cause a denial-of-service through a crafted tiff file. This vulnerability can be triggered by the executable tiffcp.,V3.0: 6.5
CVE-2018-17100,2018-09-16T21:29:01.563,"An issue was discovered in LibTIFF 4.0.9. There is a int32 overflow in multiply_ms in tools/ppm2tiff.c, which can cause a denial of service (crash) or possibly have unspecified other impact via a crafted image file.",V3.0: 8.8
CVE-2018-17101,2018-09-16T21:29:01.737,"An issue was discovered in LibTIFF 4.0.9. There are two out-of-bounds writes in cpTags in tools/tiff2bw.c and tools/pal2rgb.c, which can cause a denial of service (application crash) or possibly have unspecified other impact via a crafted image file.",V3.0: 8.8
CVE-2018-17795,2018-09-30T20:29:00.400,"The function t2p_write_pdf in tiff2pdf.c in LibTIFF 4.0.9 and earlier allows remote attackers to cause a denial of service (heap-based buffer overflow and application crash) or possibly have unspecified other impact via a crafted TIFF file, a similar issue to CVE-2017-9935.",V3.0: 8.8
CVE-2018-18557,2018-10-22T16:29:00.267,"LibTIFF 3.9.3, 3.9.4, 3.9.5, 3.9.6, 3.9.7, 4.0.0alpha4, 4.0.0alpha5, 4.0.0alpha6, 4.0.0beta7, 4.0.0, 4.0.1, 4.0.2, 4.0.3, 4.0.4, 4.0.4beta, 4.0.5, 4.0.6, 4.0.7, 4.0.8 and 4.0.9 (with JBIG enabled) decodes arbitrarily-sized JBIG into a buffer, ignoring the buffer size, which leads to a tif_jbig.c JBIGDecode out-of-bounds write.",V3.0: 8.8
CVE-2018-18661,2018-10-26T14:29:02.537,An issue was discovered in LibTIFF 4.0.9. There is a NULL pointer dereference in the function LZWDecode in the file tif_lzw.c.,V3.0: 6.5
CVE-2018-19210,2018-11-12T19:29:00.300,"In LibTIFF 4.0.9, there is a NULL pointer dereference in the TIFFWriteDirectorySec function in tif_dirwrite.c that will lead to a denial of service attack, as demonstrated by tiffset.",V3.0: 6.5
CVE-2019-6128,2019-01-11T05:29:01.577,"The TIFFFdOpen function in tif_unix.c in LibTIFF 4.0.10 has a memory leak, as demonstrated by pal2rgb.",V3.1: 8.8
CVE-2019-7663,2019-02-09T16:29:00.313,"An Invalid Address dereference was discovered in TIFFWriteDirectoryTagTransferfunction in libtiff/tif_dirwrite.c in LibTIFF 4.0.10, affecting the cpSeparateBufToContigBuf function in tiffcp.c. Remote attackers could leverage this vulnerability to cause a denial-of-service via a crafted tiff file. This is different from CVE-2018-12900.",V3.0: 6.5
CVE-2017-16232,2019-03-21T15:59:56.530,"** DISPUTED ** LibTIFF 4.0.8 has multiple memory leak vulnerabilities, which allow attackers to cause a denial of service (memory consumption), as demonstrated by tif_open.c, tif_lzw.c, and tif_aux.c. NOTE: Third parties were unable to reproduce the issue.",V3.0: 7.5
CVE-2019-14973,2019-08-14T06:15:10.303,"_TIFFCheckMalloc and _TIFFCheckRealloc in tif_aux.c in LibTIFF through 4.0.10 mishandle Integer Overflow checks because they rely on compiler behavior that is undefined by the applicable C standards. This can, for example, lead to an application crash.",V3.1: 6.5
CVE-2019-15141,2019-08-18T19:15:09.760,"WriteTIFFImage in coders/tiff.c in ImageMagick 7.0.8-43 Q16 allows attackers to cause a denial-of-service (application crash resulting from a heap-based buffer over-read) via a crafted TIFF image file, related to TIFFRewriteDirectory, TIFFWriteDirectory, TIFFWriteDirectorySec, and TIFFWriteDirectoryTagColormap in tif_dirwrite.c of LibTIFF. NOTE: this occurs because of an incomplete fix for CVE-2019-11597.",V3.1: 6.5
CVE-2019-17546,2019-10-14T02:15:11.107,"tif_getimage.c in LibTIFF through 4.0.10, as used in GDAL through 3.0.1 and other products, has an integer overflow that potentially causes a heap-based buffer overflow via a crafted RGBA image, related to a ""Negative-size-param"" condition.",V3.1: 8.8
CVE-2014-8128,2020-02-12T03:15:10.740,"LibTIFF prior to 4.0.4, as used in Apple iOS before 8.4 and OS X before 10.10.4 and other products, allows remote attackers to cause a denial of service (out-of-bounds write) via a crafted TIFF image.",V3.1: 6.5
CVE-2020-35654,2021-01-12T09:15:13.917,"In Pillow before 8.1.0, TiffDecode has a heap-based buffer overflow when decoding crafted YCbCr files because of certain interpretation conflicts with LibTIFF in RGBA mode.",V3.1: 8.8
CVE-2020-35521,2021-03-09T20:15:12.773,"A flaw was found in libtiff. Due to a memory allocation failure in tif_read.c, a crafted TIFF file can lead to an abort, resulting in denial of service.",V3.1: 5.5
CVE-2020-35522,2021-03-09T20:15:12.867,"In LibTIFF, there is a memory malloc failure in tif_pixarlog.c. A crafted TIFF document can lead to an abort, resulting in a remote denial of service attack.",V3.1: 5.5
CVE-2020-35523,2021-03-09T20:15:12.963,"An integer overflow flaw was found in libtiff that exists in the tif_getimage.c file. This flaw allows an attacker to inject and execute arbitrary code when a user opens a crafted TIFF file. The highest threat from this vulnerability is to confidentiality, integrity, as well as system availability.",V3.1: 7.8
CVE-2020-35524,2021-03-09T20:15:13.040,"A heap-based buffer overflow flaw was found in libtiff in the handling of TIFF images in libtiff's TIFF2PDF tool. A specially crafted TIFF file can lead to arbitrary code execution. The highest threat from this vulnerability is to confidentiality, integrity, as well as system availability.",V3.1: 7.8
CVE-2021-25289,2021-03-19T04:15:13.280,An issue was discovered in Pillow before 8.1.1. TiffDecode has a heap-based buffer overflow when decoding crafted YCbCr files because of certain interpretation conflicts with LibTIFF in RGBA mode. NOTE: this issue exists because of an incomplete fix for CVE-2020-35654.,V3.1: 9.8
CVE-2020-19131,2021-09-07T15:15:07.320,"Buffer Overflow in LibTiff v4.0.10 allows attackers to cause a denial of service via the ""invertImage()"" function in the component ""tiffcrop"".",V3.1: 7.5
CVE-2020-19143,2021-09-09T15:15:07.643,"Buffer Overflow in LibTiff v4.0.10 allows attackers to cause a denial of service via the ""TIFFVGetField"" funtion in the component 'libtiff/tif_dir.c'.",V3.1: 6.5
CVE-2020-19144,2021-09-09T15:15:08.517,Buffer Overflow in LibTiff v4.0.10 allows attackers to cause a denial of service via the 'in _TIFFmemcpy' funtion in the component 'tif_unix.c'.,V3.1: 6.5
CVE-2022-22844,2022-01-10T14:12:58.320,LibTIFF 4.3.0 has an out-of-bounds read in _TIFFmemcpy in tif_unix.c in certain situations involving a custom tag and 0x0200 as the second word of the DE field.,V3.1: 5.5
CVE-2022-0561,2022-02-11T18:15:11.033,"Null source pointer passed as an argument to memcpy() function within TIFFFetchStripThing() in tif_dirread.c in libtiff versions from 3.9.0 to 4.3.0 could lead to Denial of Service via crafted TIFF file. For users that compile libtiff from sources, the fix is available with commit eecb0712.",V3.1: 5.5
CVE-2022-0562,2022-02-11T18:15:11.083,"Null source pointer passed as an argument to memcpy() function within TIFFReadDirectory() in tif_dirread.c in libtiff versions from 4.0 to 4.3.0 could lead to Denial of Service via crafted TIFF file. For users that compile libtiff from sources, a fix is available with commit 561599c.",V3.1: 5.5
CVE-2022-0865,2022-03-10T17:44:57.563,"Reachable Assertion in tiffcp in libtiff 4.3.0 allows attackers to cause a denial-of-service via a crafted tiff file. For users that compile libtiff from sources, the fix is available with commit 5e180045.",V3.1: 6.5
CVE-2022-0891,2022-03-10T17:44:58.207,"A heap buffer overflow in ExtractImageSection function in tiffcrop.c in libtiff library Version 4.3.0 allows attacker to trigger unsafe or out of bounds memory access via crafted TIFF image file which could result into application crash, potential information disclosure or any other context-dependent impact",V3.1: 7.1
CVE-2022-0907,2022-03-11T18:15:26.217,"Unchecked Return Value to NULL Pointer Dereference in tiffcrop in libtiff 4.3.0 allows attackers to cause a denial-of-service via a crafted tiff file. For users that compile libtiff from sources, the fix is available with commit f2b656e2.",V3.1: 5.5
CVE-2022-0908,2022-03-11T18:15:27.077,Null source pointer passed as an argument to memcpy() function within TIFFFetchNormalTag () in tif_dirread.c in libtiff versions up to 4.3.0 could lead to Denial of Service via crafted TIFF file.,V3.1: 5.5
CVE-2022-0909,2022-03-11T18:15:28.047,"Divide By Zero error in tiffcrop in libtiff 4.3.0 allows attackers to cause a denial-of-service via a crafted tiff file. For users that compile libtiff from sources, the fix is available with commit f8d0f9aa.",V3.1: 5.5
CVE-2022-0924,2022-03-11T18:15:30.137,"Out-of-bounds Read error in tiffcp in libtiff 4.3.0 allows attackers to cause a denial-of-service via a crafted tiff file. For users that compile libtiff from sources, the fix is available with commit 408976c4.",V3.1: 5.5
CVE-2022-1056,2022-03-28T19:15:08.837,"Out-of-bounds Read error in tiffcrop in libtiff 4.3.0 allows attackers to cause a denial-of-service via a crafted tiff file. For users that compile libtiff from sources, the fix is available with commit 46dc8fcd.",V3.1: 5.5
CVE-2022-1210,2022-04-03T09:15:09.033,A vulnerability classified as problematic was found in LibTIFF 4.3.0. Affected by this vulnerability is the TIFF File Handler of tiff2ps. Opening a malicious file leads to a denial of service. The attack can be launched remotely but requires user interaction. The exploit has been disclosed to the public and may be used.,V3.1: 6.5
CVE-2022-1622,2022-05-11T15:15:09.237,"LibTIFF master branch has an out-of-bounds read in LZWDecode in libtiff/tif_lzw.c:619, allowing attackers to cause a denial-of-service via a crafted tiff file. For users that compile libtiff from sources, the fix is available with commit b4e79bfa.",V3.1: 5.5
CVE-2022-1623,2022-05-11T15:15:09.287,"LibTIFF master branch has an out-of-bounds read in LZWDecode in libtiff/tif_lzw.c:624, allowing attackers to cause a denial-of-service via a crafted tiff file. For users that compile libtiff from sources, the fix is available with commit b4e79bfa.",V3.1: 5.5
CVE-2022-2056,2022-06-30T16:15:08.287,"Divide By Zero error in tiffcrop in libtiff 4.4.0 allows attackers to cause a denial-of-service via a crafted tiff file. For users that compile libtiff from sources, the fix is available with commit f3a5e010.",V3.1: 6.5
CVE-2022-2057,2022-06-30T16:15:08.357,"Divide By Zero error in tiffcrop in libtiff 4.4.0 allows attackers to cause a denial-of-service via a crafted tiff file. For users that compile libtiff from sources, the fix is available with commit f3a5e010.",V3.1: 6.5
CVE-2022-2058,2022-06-30T16:15:08.410,"Divide By Zero error in tiffcrop in libtiff 4.4.0 allows attackers to cause a denial-of-service via a crafted tiff file. For users that compile libtiff from sources, the fix is available with commit f3a5e010.",V3.1: 6.5
CVE-2022-34266,2022-07-19T20:15:11.367,"The libtiff-4.0.3-35.amzn2.0.1 package for LibTIFF on Amazon Linux 2 allows attackers to cause a denial of service (application crash), a different vulnerability than CVE-2022-0562. When processing a malicious TIFF file, an invalid range may be passed as an argument to the memset() function within TIFFFetchStripThing() in tif_dirread.c. This will cause TIFFFetchStripThing() to segfault after use of an uninitialized resource.",V3.1: 5.5
CVE-2022-34526,2022-07-29T23:15:08.113,"A stack overflow was discovered in the _TIFFVGetField function of Tiffsplit v4.4.0. This vulnerability allows attackers to cause a Denial of Service (DoS) via a crafted TIFF file parsed by the ""tiffsplit"" or ""tiffcrop"" utilities.",V3.1: 6.5
CVE-2022-2867,2022-08-17T22:15:08.697,"libtiff's tiffcrop utility has a uint32_t underflow that can lead to out of bounds read and write. An attacker who supplies a crafted file to tiffcrop (likely via tricking a user to run tiffcrop on it with certain parameters) could cause a crash or in some cases, further exploitation.",V3.1: 5.5
CVE-2022-2868,2022-08-17T22:15:08.753,libtiff's tiffcrop utility has a improper input validation flaw that can lead to out of bounds read and ultimately cause a crash if an attacker is able to supply a crafted file to tiffcrop.,V3.1: 5.5
CVE-2022-2869,2022-08-17T22:15:08.807,"libtiff's tiffcrop tool has a uint32_t underflow which leads to out of bounds read and write in the extractContigSamples8bits routine. An attacker who supplies a crafted file to tiffcrop could trigger this flaw, most likely by tricking a user into opening the crafted file with tiffcrop. Triggering this flaw could cause a crash or potentially further exploitation.",V3.1: 5.5
CVE-2022-2953,2022-08-29T15:15:10.730,"LibTIFF 4.4.0 has an out-of-bounds read in extractImageSection in tools/tiffcrop.c:6905, allowing attackers to cause a denial-of-service via a crafted tiff file. For users that compile libtiff from sources, the fix is available with commit 48d6ece8.",V3.1: 5.5
CVE-2022-1354,2022-08-31T16:15:09.520,"A heap buffer overflow flaw was found in Libtiffs' tiffinfo.c in TIFFReadRawDataStriped() function. This flaw allows an attacker to pass a crafted TIFF file to the tiffinfo tool, triggering a heap buffer overflow issue and causing a crash that leads to a denial of service.",V3.1: 5.5
CVE-2022-1355,2022-08-31T16:15:09.577,"A stack buffer overflow flaw was found in Libtiffs' tiffcp.c in main() function. This flaw allows an attacker to pass a crafted TIFF file to the tiffcp tool, triggering a stack buffer overflow issue, possibly corrupting the memory, and causing a crash that leads to a denial of service.",V3.1: 6.1
CVE-2022-2519,2022-08-31T16:15:11.057,There is a double free or corruption in rotateImage() at tiffcrop.c:8839 found in libtiff 4.4.0rc1,V3.1: 6.5
CVE-2022-2520,2022-08-31T16:15:11.117,A flaw was found in libtiff 4.4.0rc1. There is a sysmalloc assertion fail in rotateImage() at tiffcrop.c:8621 that can cause program crash when reading a crafted input.,V3.1: 6.5
CVE-2022-2521,2022-08-31T16:15:11.170,It was found in libtiff 4.4.0rc1 that there is an invalid pointer free operation in TIFFClose() at tif_close.c:131 called by tiffcrop.c:2522 that can cause a program crash and denial of service while processing crafted input.,V3.1: 6.5
CVE-2022-3570,2022-10-21T16:15:10.913,"Multiple heap buffer overflows in tiffcrop.c utility in libtiff library Version 4.4.0 allows attacker to trigger unsafe or out of bounds memory access via crafted TIFF image file which could result into application crash, potential information disclosure or any other context-dependent impact",V3.1: 5.5
CVE-2022-3597,2022-10-21T16:15:10.973,"LibTIFF 4.4.0 has an out-of-bounds write in _TIFFmemcpy in libtiff/tif_unix.c:346 when called from extractImageSection, tools/tiffcrop.c:6826, allowing attackers to cause a denial-of-service via a crafted tiff file. For users that compile libtiff from sources, the fix is available with commit 236b7191.",V3.1: 6.5
CVE-2022-3598,2022-10-21T16:15:11.030,"LibTIFF 4.4.0 has an out-of-bounds write in extractContigSamplesShifted24bits in tools/tiffcrop.c:3604, allowing attackers to cause a denial-of-service via a crafted tiff file. For users that compile libtiff from sources, the fix is available with commit cfbb883b.",V3.1: 6.5
CVE-2022-3599,2022-10-21T16:15:11.087,"LibTIFF 4.4.0 has an out-of-bounds read in writeSingleSection in tools/tiffcrop.c:7345, allowing attackers to cause a denial-of-service via a crafted tiff file. For users that compile libtiff from sources, the fix is available with commit e8131125.",V3.1: 6.5
CVE-2022-3626,2022-10-21T16:15:11.140,"LibTIFF 4.4.0 has an out-of-bounds write in _TIFFmemset in libtiff/tif_unix.c:340 when called from processCropSelections, tools/tiffcrop.c:7619, allowing attackers to cause a denial-of-service via a crafted tiff file. For users that compile libtiff from sources, the fix is available with commit 236b7191.",V3.1: 6.5
CVE-2022-3627,2022-10-21T16:15:11.197,"LibTIFF 4.4.0 has an out-of-bounds write in _TIFFmemcpy in libtiff/tif_unix.c:346 when called from extractImageSection, tools/tiffcrop.c:6860, allowing attackers to cause a denial-of-service via a crafted tiff file. For users that compile libtiff from sources, the fix is available with commit 236b7191.",V3.1: 6.5
CVE-2022-3970,2022-11-13T08:15:16.047,A vulnerability was found in LibTIFF. It has been classified as critical. This affects the function TIFFReadRGBATileExt of the file libtiff/tif_getimage.c. The manipulation leads to integer overflow. It is possible to initiate the attack remotely. The exploit has been disclosed to the public and may be used. The name of the patch is 227500897dfb07fb7d27f7aa570050e62617e3be. It is recommended to apply a patch to fix this issue. The identifier VDB-213549 was assigned to this vulnerability.,V3.1: 8.8
CVE-2022-48281,2023-01-23T03:15:09.447,"processCropSelections in tools/tiffcrop.c in LibTIFF through 4.5.0 has a heap-based buffer overflow (e.g., ""WRITE of size 307203"") via a crafted TIFF image.",V3.1: 5.5
CVE-2023-0795,2023-02-13T23:15:11.727,"LibTIFF 4.4.0 has an out-of-bounds read in tiffcrop in tools/tiffcrop.c:3488, allowing attackers to cause a denial-of-service via a crafted tiff file. For users that compile libtiff from sources, the fix is available with commit afaabc3e.",V3.1: 5.5
CVE-2023-0796,2023-02-13T23:15:11.857,"LibTIFF 4.4.0 has an out-of-bounds read in tiffcrop in tools/tiffcrop.c:3592, allowing attackers to cause a denial-of-service via a crafted tiff file. For users that compile libtiff from sources, the fix is available with commit afaabc3e.",V3.1: 5.5
CVE-2023-0797,2023-02-13T23:15:11.970,"LibTIFF 4.4.0 has an out-of-bounds read in tiffcrop in libtiff/tif_unix.c:368, invoked by tools/tiffcrop.c:2903 and tools/tiffcrop.c:6921, allowing attackers to cause a denial-of-service via a crafted tiff file. For users that compile libtiff from sources, the fix is available with commit afaabc3e.",V3.1: 5.5
CVE-2023-0798,2023-02-13T23:15:12.073,"LibTIFF 4.4.0 has an out-of-bounds read in tiffcrop in tools/tiffcrop.c:3400, allowing attackers to cause a denial-of-service via a crafted tiff file. For users that compile libtiff from sources, the fix is available with commit afaabc3e.",V3.1: 5.5
CVE-2023-0799,2023-02-13T23:15:12.170,"LibTIFF 4.4.0 has an out-of-bounds read in tiffcrop in tools/tiffcrop.c:3701, allowing attackers to cause a denial-of-service via a crafted tiff file. For users that compile libtiff from sources, the fix is available with commit afaabc3e.",V3.1: 5.5
CVE-2023-0800,2023-02-13T23:15:12.260,"LibTIFF 4.4.0 has an out-of-bounds write in tiffcrop in tools/tiffcrop.c:3502, allowing attackers to cause a denial-of-service via a crafted tiff file. For users that compile libtiff from sources, the fix is available with commit 33aee127.",V3.1: 5.5
CVE-2023-0801,2023-02-13T23:15:12.370,"LibTIFF 4.4.0 has an out-of-bounds write in tiffcrop in libtiff/tif_unix.c:368, invoked by tools/tiffcrop.c:2903 and tools/tiffcrop.c:6778, allowing attackers to cause a denial-of-service via a crafted tiff file. For users that compile libtiff from sources, the fix is available with commit 33aee127.",V3.1: 5.5
CVE-2023-0802,2023-02-13T23:15:12.467,"LibTIFF 4.4.0 has an out-of-bounds write in tiffcrop in tools/tiffcrop.c:3724, allowing attackers to cause a denial-of-service via a crafted tiff file. For users that compile libtiff from sources, the fix is available with commit 33aee127.",V3.1: 5.5
CVE-2023-0803,2023-02-13T23:15:12.567,"LibTIFF 4.4.0 has an out-of-bounds write in tiffcrop in tools/tiffcrop.c:3516, allowing attackers to cause a denial-of-service via a crafted tiff file. For users that compile libtiff from sources, the fix is available with commit 33aee127.",V3.1: 5.5
CVE-2023-0804,2023-02-13T23:15:12.667,"LibTIFF 4.4.0 has an out-of-bounds write in tiffcrop in tools/tiffcrop.c:3609, allowing attackers to cause a denial-of-service via a crafted tiff file. For users that compile libtiff from sources, the fix is available with commit 33aee127.",V3.1: 5.5
CVE-2022-4645,2023-03-03T16:15:09.777,"LibTIFF 4.4.0 has an out-of-bounds read in tiffcp in tools/tiffcp.c:948, allowing attackers to cause a denial-of-service via a crafted tiff file. For users that compile libtiff from sources, the fix is available with commit e8131125.",V3.1: 5.5
CVE-2023-1916,2023-04-10T22:15:09.223,"A flaw was found in tiffcrop, a program distributed by the libtiff package. A specially crafted tiff file can lead to an out-of-bounds read in the extractImageSection function in tools/tiffcrop.c, resulting in a denial of service and limited information disclosure. This issue affects libtiff versions 4.x.",V3.1: 6.1
CVE-2023-30086,2023-05-09T16:15:14.507,Buffer Overflow vulnerability found in Libtiff V.4.0.7 allows a local attacker to cause a denial of service via the tiffcp function in tiffcp.c.,V3.1: 5.5
CVE-2023-2731,2023-05-17T22:15:11.047,"A NULL pointer dereference flaw was found in Libtiff's LZWDecode() function in the libtiff/tif_lzw.c file. This flaw allows a local attacker to craft specific input data that can cause the program to dereference a NULL pointer when decompressing a TIFF format file, resulting in a program crash or denial of service.",V3.1: 5.5
CVE-2023-30774,2023-05-19T15:15:08.923,A vulnerability was found in the libtiff library. This flaw causes a heap buffer overflow issue via the TIFFTAG_INKNAMES and TIFFTAG_NUMBEROFINKS values.,V3.1: 5.5
CVE-2023-30775,2023-05-19T15:15:08.980,"A vulnerability was found in the libtiff library. This security flaw causes a heap buffer overflow in extractContigSamples32bits, tiffcrop.c.",V3.1: 5.5
CVE-2023-25434,2023-06-14T20:15:09.337,libtiff 4.5.0 is vulnerable to Buffer Overflow via extractContigSamplesBytes() at /libtiff/tools/tiffcrop.c:3215.,V3.1: 8.8
CVE-2023-26965,2023-06-14T21:15:09.483,loadImage() in tools/tiffcrop.c in LibTIFF through 4.5.0 has a heap-based use after free via a crafted TIFF image.,V3.1: 5.5
CVE-2023-3316,2023-06-19T12:15:09.520,"A NULL pointer dereference in TIFFClose() is caused by a failure to open an output file (non-existent path or a path that requires permissions like /dev/null) while specifying zones.

",V3.1: 6.5
CVE-2023-25435,2023-06-21T20:15:10.100,libtiff 4.5.0 is vulnerable to Buffer Overflow via extractContigSamplesShifted8bits() at /libtiff/tools/tiffcrop.c:3753.,V3.1: 5.5
